<?xml version="1.0" encoding="UTF-8"?>
<ZeFWConfig xmlns:xsi="http://www.w3.org/2001/XMLSchema-instance"
   xmlns="http://www.mvpanchal.org/zefw/config"
   xsi:schemaLocation="http://www.mvpanchal.org/zefw/config zefw.xsd">
   <Models>
       <Model name="user" type="com.mvpanchal.eclinic.model.User"/>
       <Model name="patient" type="com.mvpanchal.eclinic.model.Patient"/>
   </Models>
   
   <Views>
       <View name="login" page="login.jsp"/>
       <View name="adminhome" page="adminhome.jsp"/>
       <View name="doctorhome" page="doctorhome.jsp"/>
       <View name="newcase" page="newcase.jsp"/>
   </Views>
   
   <Actions>
       <Action name="login" handler="com.mvpanchal.eclinic.actionhandler.LoginHandler">
           <ModelNames>
               <ModelName name="user"/>
           </ModelNames>
           <ActionValidators>
               <ActionValidator type="com.mvpanchal.eclinic.actionvalidator.LoginValidator"/>
           </ActionValidators>
       </Action>
       <Action name="create_new_case" handler="com.mvpanchal.eclinic.actionhandler.NewCaseHandler">
           <ModelNames>
               <ModelName name="patient"/>
           </ModelNames>
       </Action>
   </Actions>
   
   <ApplicationProperties filepath="D:/java/Project/eclinic/eclinic.properties"/>

</ZeFWConfig>
